Paper Title,Year,Full Paper or WIP?,Session Name,"Context: MOOCs, In-person degrees, Online degrees, K-12, Informal learning environments, Other (specify in 1-2 words in Context Notes)",Context Notes,"Subject: CS, Non-CS STEM, Non-STEM (specify in 1-2 words in Subject Notes), Unspecified",Subject Notes,"Accessibility & Inclusivity? (Enter ""Y"" or ""N"")",Notes for Wrtiteup
Student skill and goal achievement in the mapping with google MOOC,2014,Full Paper,Student Skills and behavior,MOOCs,Define course success based on completion of goals within the course and the complete course itself,Non-STEM,Mapping with Google Course was created to teach the general public how to use Google’s mapping and Google Earth products more efficiently and effectively,N,
Correlating Skill and Improvement in 2 MOOCs with a Student’s Time on Tasks,2014,Full Paper,Student Skills and behavior,MOOCs,"Examining correlations between time spent on specific course resources and various measures of student performance: score on assessments, skill as defined by Item Response Theory, improvement in skill over the period of the course, and conceptual improvement",Non-CS STEM,Two MOOCs offered on edX.org by MIT faculty: Circuits and Electronics (6.002x) and Mechanics Review (8.MReV),N,
Demographic differences in how students navigate through MOOCs,2014,Full Paper,Student Skills and behavior,MOOCs,Analysis to attract a diverse student audience from all age groups and countries,Multiple,"Four edX MOOCs - 2 CS, 2 Non-CS STEM - 6.00x Intro. CS & Programming MIT, CS188.1x Artificial Intelligence Berkeley, PH207x Statistics for Public Health Harvard, 3.091x Solid State Chemistry MIT",Y,"older students and those from countries with lower student-teacher ratios are more comprehensive and non linear when navigating through the course. While students tend to ignore the linear structure of xMOOCs, younger students and those from countries with higher student-teacher ratios (e.g., India, Kenya, Pakistan) follow the teacher-provided outline more strictly."
Understanding in-video dropouts and interaction peaks inonline lecture videos,2014,Full Paper,Course materials,MOOCs,A large-scale analysis of in-video dropout and peaks in viewership and student activity,Multiple,"Four edX MOOCs - 2 CS, 2 Non-CS STEM - 6.00x Intro. CS & Programming MIT, CS188.1x Artificial Intelligence Berkeley, PH207x Statistics for Public Health Harvard, 3.091x Solid State Chemistry MIT",N,
How video production affects student engagement: an empirical study of MOOC videos,2014,Full Paper,Course materials,MOOCs,How video production decisions affect student engagement in online educational videos,Multiple,"Four edX MOOCs - 2 CS, 2 Non-CS STEM - 6.00x Intro. CS & Programming MIT, CS188.1x Artificial Intelligence Berkeley, PH207x Statistics for Public Health Harvard, 3.091x Solid State Chemistry MIT",N,
Hint systems may negatively impact performance in educational games,2014,Full Paper,Course materials,Informal Learning Environments,Study the effects of hint systems on player behavior in the educational game Refraction,Non-CS STEM,The refraction game is used to teach fraction concepts to elementary school students. ,N,
Teaching recommender systems at large scale: evaluation and lessons learned from a hybrid MOOC,2014,Full Paper,The role of the instructor,MOOCs,"Online as well as for-credit version of the course on-campus using the Coursera platform and a flipped classroom instruction model. Performed extensive evaluation including surveys of demographics, self-assessed skills, and learning intent.  ",CS,Introduction to Recommender Systems through Coursera,N,
Do professors matter?: using an a/b test to evaluate the impact of instructor involvement on MOOC student outcomes,2014,Full Paper,The role of the instructor,MOOCs,"An A/B test was used to randomly assign MOOC participants in either a control group (with no instructional interaction) or an intervention group (in which the professor and teaching assistants responded to comments in the discussion and complied summary weekly feedback statements) to identify the differences in learning outcomes, participation rates, and student satisfaction. ",Non-STEM,“Introduction to Sustainability” was delivered by the University of Illinois at Urbana-Champaign (UIUC) via Coursera,N,
Monitoring MOOCs: which information sources do instructors value?,2014,Full Paper,The role of the instructor,MOOCs,"This paper reports the results of a survey of 92 MOOC instructors who answered questions about which information they find useful in their course, with the end goal of creating an information display for MOOC instructors.",Unspecified,92 MOOC instructors ,N,
Divide and correct: using clusters to grade short answers at scale,2014,Full Paper,Assessment,Informal Learning Environments,"This paper proposes a cluster-based interface that allows teachers to read, grade, and provide feedback on large groups of answers at once.",Unspecified,"We evaluated this interface against an unclustered baseline in a within-subjects study with 25 teachers, and found that the clustered interface allows teachers to grade substantially faster, to give more feedback to students, and to develop a high-level view of students’ understanding and misconceptions. Powergrading Short Answer Grading Corpus",N,
Scaling short-answer grading by combining peer assessment with algorithmic scoring,2014,Full Paper,Assessment,Other,This paper integrates peer and machine grading to preserve the robustness of peer assessment and lower grading burden.,CS,Online human-computer interaction class,N,
Self-evaluation in advanced power searching and mapping with google MOOCs,2014,Full Paper,Assessment,MOOCs,"To test the efficacy of self-evaluation as a method for complex question evaluation, students in two Google MOOCs have submitted projects and evaluated their own work",Non-STEM,Advanced Power Searching (APS) and Mapping with Google (MWG) courses,N,
Superposter behavior in MOOC forums,2014,Full Paper,Forums and chat rooms,MOOCs,Contribution behavior in these online collaborative learning forums,Unspecified,Using data from 44 MOOCs hosted on Coursera,N,
Chatrooms in MOOCs: all talk and no action,2014,Full Paper,Forums and chat rooms,MOOCs,Real-time chatroom,CS,"open-enrollment software engineering course offered on the edX platform (“CS169.1x: Software as a Service” from the University of California, Berkeley)",N,
Effective Sampling for Large-scale Automated Writing Evaluation Systems,2015,Full Paper,Analysis,MOOCs,We evaluate algorithms for ensuring that AWE models are consistently trained using the most informative essays.,Unspecified,The edX platform for massive open online classes (MOOCs) contains a system for automated writing evaluation.,N,
Improving Student Modeling Through Partial Credit and Problem Difficulty,2015,Full Paper,Analysis,Other,The present study considers a novel method of tabling an algorithmically determined partial credit score and problem difficulty bin for each student’s current problem to predict both binary and partial next problem correctness.,Non-CS STEM," ASSISTments, an adaptive mathematics tutor",N,
Addressing Common Analytic Challenges to Randomized Experiments in MOOCs: Attrition and Zero-Inflation,2015,Full Paper,Analysis,MOOCs,Improve forum participation,Non-STEM,2014 JusticeX course offered on the edX MOOC platform,N,
Structure and messaging techniques for online peer learning systems that increase stickiness,2015,Full Paper,Analysis,MOOCs,This paper measures efficacy through sign-up and participation rates and the structure and duration of student interacti,Unspecified,"8,500 students’ usage of two peer learning platforms, Talkabout and PeerStudio",N,
The Prediction of Student First Response Using Prerequisite Skills,2015,Full Paper,Behavior 1,Informal Learning Environments,Importance of prerequisite skills,Non-CS STEM,"Knowledge tracing (KT) model, the dataset used in our work is comprised of real-world algebra and geometry-based student data from the 2009-2010
academic year taken from the ASSISTments tutoring system.",N,
Blended Learning in Indian Colleges with Massively Empowered Classroom,2015,Full Paper,Behavior 1,In-person Degrees,"In order to understand how advances in online education might benefit undergraduate education in India, we built and deployed Massively Empowered Classroom (MEC), an experimental system designed to support MOOC-like functionality and blended learning for Indian colleges.",CS,"The first course we prepared was Design and Analysis of Algorithms (DAA). We restricted our experiment to colleges affiliated with 
Visvesvaraya Technological University (VTU). VTU comprises more than 200 technical colleges.",Y,In this paper we describe a blended learning initiative that combines videos from a large online course with peer-led sessions for undergraduate technical education in India.
Attrition and Achievement Gaps in Online Learning,2015,Full Paper,Behavior 1,MOOCs,Insights into why learners leave online courses inform models of attrition and targeted interventions to support learners achieve their goals,Multiple,"2 Business, 3 Computer Science, 2 Education, 3 Engineering, 2 Humanities, 2 Mathematics, 2 Natural Sciences, 1 Phyiscs, 2 Statistics, 1 Writing",Y,"Online learners in Africa, Asia, and Latin America scored substantially lower grades and were only half as likely to persist than those in Europe, Oceania, and Northern America. Women also exhibited lower persis tence and performance than men"
Towards Detecting Wheel-Spinning: Future Failure in Mastery Learning,2015,Full Paper,Behavior 1,Informal Learning Environments,We construct a model of wheel-spinning,Non-CS STEM,"We investigated the scope of the wheel-spinning problem for two tutoring systems: the Cognitive Algebra Tutor (the CAT) and ASSISTments, a math tutor",N,
PeerStudio: Rapid Peer Feedback Emphasizes Revision and Improves Performance,2015,Full Paper,Behavior 2,MOOCs,PeerStudio,Multiple,"Learning How to Learn (603 students submitting assignments), Medical Education in the New Millennium (103 students) on the Coursera and OpenEdX platforms respectively",N,
Alumni & Tenured Participants in MOOCs: Analysis of Two Years of MOOC Discussion Channel Activity,2015,Full Paper,Behavior 2,MOOCs,Two and a half years of chat logs and interviews show that it is possible that a community consisting of previous and current participants emerges naturally,CS,The data comes from a set of Finnish introductory programming MOOCs organized by the University of Helsinki,N,
A Playful Game Changer: Fostering Student Retention in Online Education with Social Gamification,2015,Full Paper,Behavior 2,MOOCs,Gamification features introduced ,CS,The course used for the experiment introduces Python as a programming language for statistical analysis and has an expected duration of four-weeks with an average workload of 4 hours per week,N,
moocRP: An Open-source Analytics Platform,2015,Full Paper,Behavior 2,MOOCs,We introduce a tool moocRP that integrates data request/authorization and distribution workflows as well as a simple analytics  module upload format to enable reuse and replication of analytics results among instructors and researchers.,Unspecified,The most primitive form of data that is obtained from edX by partner schools is the tracking and database logs [18] hosted by Amazon S3 storage service.,N,
Learning is Not a Spectator Sport: Doing is Better than Watching for Learning from a MOOC,2015,Full Paper,Learning,MOOCs,We find that students doing more activities learn more than students watching more videos or reading more pages,Non-STEM,"In 2013, Georgia Institute of Technology and Carnegie Mellon University 
(CMU) collaborated to incorporate elements of CMU’s Open Learning Initiative (OLI) “Introduction to Psychology” learning environment into Tech’s Introduction to Psychology as a Science MOOC taught via the Coursera platform.",N,
Exploring the Effect of Confusion in Discussion Forums of Massive Open Online Courses,2015,Full Paper,Learning,MOOCs,Quantify confusion,Multiple,"Our dataset for this paper consists of two Coursera courses: one mathematics course, “Algebra” and one economics course “Microeconomics”",Y,"(1)  We also examined how confusion varies across different demographic groups, in terms of Gender, Age and Highest Education Level. The average confusion degree comparisons over different demographics are presented in Figure 1(b), and Figure 1(c). We found that females tend to express more confusion than males; young people have the highest expressed confusion; and middle-aged people are the least likely to express confusion. In addition, students who achieved higher education degrees shared a relatively low level of confusion compared to students whose highest education were primary school or no completion.the more students express their confusion and are exposed to confusion in the MOOC forums, the less likely students are to remain active in the learning community; (2) helping resolving or provid ing responses to student confusion reduces their dropout in the courses; (3) the extent to which different types of confu sion affect dropout is determined by specific courses."
Uncovering Trajectories of Informal Learning in Large Online Communities of Creators,2015,Full Paper,Learning,Informal Learning Environments,Scratch,CS,"The Lifelong Kindergarten Group at the MIT Media Lab created the Scratch dataset from the Scratch Online Community [24, 25]. It contains five years of data between 2007 and 2012, including 1 million users and their 1.9 million projects, grouped in five categories.",N,
Probabilistic Use Cases: Discovering Behavioral Patterns for Predicting Certification,2015,Full Paper,Learning,MOOCs,Latent Dirichlet Allocation (LDA) to uncover behavioral structure from student logs,Non-CS STEM,"MITx Massive Open Online Course, 8.02x: Electricity and Magnetism",N,
Bayesian Ordinal Peer Grading,2015,Full Paper,Grading,MOOCs,"Ordinal peer grading, where individual grader orderings are aggregated into an overall ordering of assignments",Unspecified,"This data was collected as part of a senior-undergraduate and masters-level class with an enrollment of about 170 students. The class was staffed with 9 Teaching Assistants (TAs) that participated in grading, and a single Instructor.",N,
An Automated Grading/Feedback System for 3-View Engineering Drawings using RANSAC,2015,Full Paper,Grading,In-person Degrees,Automated grading system for AutoCAD,Non-CS STEM,"Course “Basic Engineering Design Graphics,” Engineering 28 (E28), University of California at Berkeley",N,
Mathematical Language Processing: Automatic Grading and Feedback for Open Response Mathematical Questions,2015,Full Paper,Grading,MOOCs,Automatically grading the kinds of open response mathematical questions,Non-CS STEM,Our dataset that consists of 116 learners solving 4 open response mathematical questions in an edX course,N,
BayesRank: A Bayesian Approach to Ranked Peer Grading,2015,Full Paper,Grading,In-person Degrees,Adopt a Bayesian approach to the ranked peer grading problem and develop a novel model and method for utilizing ranked peer-grading data,CS,We now present the results of the analysis of a classroom of 60 learners in a computer programming class taught at Arizona State University,N,
Staggered Versus All-At-Once Content Release in Massive Open Online Courses: Evaluating a Natural Experiment,2015,Full Paper,Design,MOOCs,Testing the effects of releasing all of the content in an MOOC,Non-CS STEM,HeroesX course by HarvardX,N,
Autonomously Generating Hints by Inferring Problem Solving Policies,2015,Full Paper,Design,Informal Learning Environments,Framework for hint generating algorithms,CS,"Hour of Code website, the dataset for this paper is the series of partial solutions from all logged in students from December 2013 to March 2014. In that time Code.org gathered over 137 million partial solutions.",N,
Problems Before Solutions: Automated Problem Clarification at Scale,2015,Full Paper,Design,In-person Degrees, Automatic assessment - first unlock each test case by validating its behavior before students are allowed to apply it to their proposed solution,CS,"Introductory computer science, CS 61A: Structure and Interpretation of Computer Programs at University of California, Berkeley",N,
A Modern Student Experience inSystems Programming,2015,WIP,,In-person Degrees,“modern” systems course,CS, UC Berkeley’s CS 162 Operating Systems and Systems Programming,N,
Adding Third-Party Authentication to Open edX: A Case Study,2015,WIP,,MOOCs,,Unspecified,Authentication,N,
All It Takes Is One: Evidence for a Strategy for Seeding Large Scale Peer Learning Interactions,2015,WIP,,Informal Learning Environments,,Unspecified,Questions were selected from a set of 20 GMAT practice questions on critical reasoning,N,
An E-Report Scoring Method based on Student Peer Evaluation using Groupware,2015,WIP,,In-person Degrees,Universities utilize groupware support for students to post and share their e-reports,Unspecified,E-report scoring method based on student peer evaluation by considering the relationship between voting and posting time of the e-reports,N,
Analysis of a Large-Scale Formative Writing Assessment System with Automated Feedback,2015,WIP,,Informal Learning Environments,,Non-STEM,The data comprised two large samples of student interactions with WriteToLearn collected from U.S. adoptions of the software,N,
Are You Listening?: Social Roles and Perceived Value of Statements in Online Learning Communities,2015,WIP,,MOOCs,,Non-STEM,Collected an Amazon M-Turk sample of 45 individuals,N,
Assessment of KNOWLA: Knowledge Assembly for Learning and Assessment,2015,WIP,,In-person Degrees,,Non-STEM,Fifty graduate students in the School of Education at Boston University participated in this sub study during the course “Introduction to Educational Research  Methods”. ,N,
AutoStyle: Toward Coding Style Feedback at Scale,2015,WIP,,MOOCs,,CS,"UC Berkeley’s SaaS MOOC “Engineering Software as a Service”, 800 submissions - Ruby programming assignment, 200 submissions - Python assignment ",N,
Behavior Prediction in MOOCs using Higher Granularity Temporal Information,2015,WIP,,MOOCs,,CS,"“Pattern-Oriented Software Architectures for Concurrent and Networked Software” (POSA) Coursera MOOC, “Data Management for Clinical Research” (DM) Coursera MOOC",N,
Clustering Student Programming Assignments to Multiply Instructor Leverage,2015,WIP,,MOOCs,,CS,MOOC “Engineering Software as a Service” from UC Berkeley and edX,N,
Clustering-Based Active Learning for CPSGrader,2015,WIP,,MOOCs,,CS,Introduction to Embedded Systems at UC Berkeley and its online counterpart on edX,N,
Connecting Stories and Pedagogy Increases Participant Engagement in Discussions,2015,WIP,,MOOCs,,Non-STEM,"Philanthropy MOOC on Coursera, “Giving 2.0”",N,
Connecting the Dots: Predicting Student Grade Sequences from Bursty MOOC Interactions over Time,2015,WIP,,MOOCs,,Multiple,"Our study context comprises of de-identified data from the first year (Academic Year 2013: Fall 2012, Spring 2013, and Summer 2013) of 13 MITx and HarvardX courses offered on the edX platform",N,
Cultural Relevance in MOOCs: Asking About Socioeconomic Context,2015,WIP,,MOOCs,,Unspecified,"All 24 participants either were from the U.S. and did not have a college degree (n=11), or were of a non-U.S. cultural and educational background (n=13)",Y,Preliminary results suggest that a large-scale survey designed for both cross-national and country-specific analyses would provide valuable information to MOOC researchers.
Demographic Differences in a Growth Mindset Incentive Structure for Educational Games,2015,WIP,,K12,,Non-CS STEM,"Game Refraction, fraction concepts",Y,"We also explore how brain points impact students from different demographic groups. We find that brain points are less engaging for low-income students, and discuss methods of improving our design in the future"
Designing MOOCs as Interactive Places for Collaborative Learning,2015,WIP,,MOOCs,,Unspecified,Collaborative Learning,N,
Do Numeric Ratings Impact Peer Reviewers?  359-362,2015,WIP,,Informal Learning Environments,,Multiple,"Participants were recruited through from online advertisements as well as flyers on a Southern California University campus. There were 53 participants; 70% applying to a Science program, 21% Social Science, and 9% Arts & Humanities or Other.  41% of participants were enrolled in college, and 88% of participants were native English speakers",N,
Does Online Q&A Activity Vary Based on Topic: A Comparison of Technical and Non-technical Stack Exchange Forums,2015,WIP,,Informal Learning Environments,Examine the effect of incentives on contributions ,Multiple,"Classify the online community participation on Stack Exchange into two different genres, one is technical and another is non-technical",N,
"Educational Evaluation in the PKU SPOC Course ""Data Structures and Algorithms""",2015,WIP,,MOOCs,,CS,Course of Data Structures and Algorithms in Peking University,N,
"Evaluating the Relationship Between Course Structure, Learner Activity, and Perceived Value of Online Courses",2015,WIP,,MOOCs,,Multiple,26 online courses,N,
Exploring Collaborative Storytelling as a Method for Creating Educational Games,2015,WIP,,Informal Learning Environments,,Non-STEM,"Three-day hackathon that united top science fiction writers, artists, futurists, and subject area experts to develop narratives and visual artwork for EVOKE’s fictional universe.",N,
Feature Factory: Crowd Sourced Feature Discovery,2015,WIP,,MOOCs,,Unspecified,class at MIT called 6.MITx,N,
Game Theory based Peer Grading Mechanisms for MOOCs,2015,WIP,,MOOCs,,Unspecified,We tested and verified the Calibration mechanism through an anonymous crowd-sourced experiment,N,
Identifying Content-Related Threads in MOOC Discussion Forums,2015,WIP,,MOOCs,,Non-STEM,"The study was conducted on discussion forum data extracted from an introductory psychology course with 27,739 users offered through Coursera",N,
Item Ordering Effects with Qualitative Explanations using Online Adaptive Tutoring Data,2015,WIP,,Other,"In this paper, we use BKT models to find such context sensitive transition probabilities from real data delivered by an online tutoring system, ASSISTments.",Unspecified,The data set analyzed in this paper comes from the publicly available ASSISTments 2012-2013 data set,N,
Learn With Friends: The Effects of Student Face-to-Face Collaborations on Massive Open Online Course Activities,2015,WIP,,MOOCs,,Non-STEM,Instructional Methods in Health Professions Education via Coursera,N,
Learner-Sourcing in an Engineering Class at Scale,2015,WIP,,MOOCs,,CS,Computer Architecture on edX offered by MIT,N,
Learnersourcing of Complex Assessments,2015,WIP,,MOOCs,,Non-CS STEM,6.002x MIT,N,
Learning Experiments Using AB Testing at Scale,2015,WIP,,MOOCs,,Non-CS STEM,MOOC 8.MReVx on the edX.org platform,N,
Learning the Features Used To Decide How to Teach,2015,WIP,,Informal Learning Environments,,Non-CS STEM,"We tried this approach in an education context, for a module about histograms. Our materials were developed as extensions of the Statway curriculum that was itself designed to help community college remedial math students.",N,
M-CAFE: Managing MOOC Student Feedback with Collaborative Filtering,2015,WIP,,MOOCs,,CS,"June-July 2014, 6-week EdX MOOC course CS 169.2x and the OctoberDecember 2014, 8-week EdX MOOC course CS 169.1x: Engineering Software as a Service",N,
Measuring and Maximizing the Effectiveness of Honor Codes in Online Courses,2015,WIP,,MOOCs,,CS,“The Design and Analysis of Algorithms”,N,
"Peers in MOOCs: Lessons Based on the Education Production Function, Collective Action, and an Experiment",2015,WIP,,MOOCs,,Unspecified,Three related connectivist MOOCs on the NovoEd platform in spring 2014 targeted practicing teachers and were available for free,N,
Practical Measures of Learning Behaviors,2015,WIP,,In-person Degrees,,Non-CS STEM,mathematics and statistical reasoning content,N,
Source Effects in Online Education,2015,WIP,,Informal Learning Environments,MEC Platform,CS,Sorting Algorithms,N,
Supporting Face-to-Face Like Communication Modalities for Asynchronous Assignment Feedback in Math Education,2015,WIP,,Informal Learning Environments,"RichReview, a document annotation system which creates inking, voice and deictic gestures on top of the student’s submitted work, is a possible formative math feedback solution, because it enables face-to-face like commentary within the contexts of the document at hand. A preliminary qualitative evaluation study conducted while having students receive RichReview feedb",Non-CS STEM,Math,N,
Supporting Instructors in Collaborating with Researchers using MOOClets,2015,WIP,,K12,,Non-CS STEM,"Math - embedding experiments in K-12 math exercises on Khan Academy, videos on EdX, and teacher and medical professional development on NovoEd and Moodle",N,
TELLab: An Experiential Learning Tool for Psychology,2015,WIP,,Informal Learning Environments,,Non-STEM,Psychology,N,
Technology-Enhanced Learning: Evidence-based Improvement,2015,WIP,,Other,This paper abstracts 4 categories from our on-going work of educational technology research which we have found to be important in considering what constitutes a successful Technology-Enhanced Learning implementation,Unspecified,,N,
The Visible and Invisible in a MOOC Discussion Forum,2015,WIP,,MOOCs,,CS,"We were given access to anonymized data from the two iterations of MITx 6.00x – Introduction to Computer Science and Programming, offered in Fall 2012 and Spring 2013.",N,
