Toward the Evaluation of Educational Videos using Bayesian Knowledge Tracing and Big Data,2015,WIP,,MOOCs,,Multiple,"The data we obtained from Khan Academy contains 1,044,930 problem attempts and 3,797,676 video observation events collected over about two years, from June 2012 to February 2014.",N,
Towards Capturing Learners Sentiment and Context,2015,WIP,,Informal Learning Environments,,Unspecified,"We conduced field studies with teachers and students from two primary schools, Nairobi, Kenya.",N,
Understanding Learners' General Perception Towards Learning with MOOC Classmates: An Exploratory Study,2015,WIP,,MOOCs,,Unspecified,"Recruited participants were asked to provide demographic data (e.g., gender, occupation, country of origin) and experience on MOOCs (e.g., completed and uncompleted course and etc.) using Google Form before the interview",N,
Using and Designing Platforms for In Vivo Educational Experiments,2015,WIP,,MOOCs,,Unspecified,Iterative Improvement and Collaborative Work,N,
Viz-R: Using Recency to Improve Student and Domain Models,2015,WIP,,Other,"Examples are presented of randomized experimental comparisons conducted by subsets of the authors in three widely used online educational platforms – Khan Academy, edX, and ASSISTment",Unspecified,,N,
Who You Are or What You Do: Comparing the Predictive Power of Demographics vs,2015,WIP,,MOOCs,,CS,"We considered data from a MOOC course which was a broadly accessible introduction on Internet technologies. This MOOC ran three times each over 11 weeks, with tens of thousands of learners enrolled in each offering",Y,"Demographics, including your location and whether you are paying for a certificate, have minimal predictive  power when determining the academic achievement of learners enrolled in MOOCs. "
Automatic Interpretable Personalized Learning,2022,Full Paper,Recommendation and Personalization @ Scale,Informal Learning Environments,"The APLS uses multi-armed bandit algorithms to recommend the most effective support to each student that requests assistance when completing their online work, and is currently used by ASSISTments, an online learning platform.",Non-CS STEM,Math,N,
Heterogeneity of Treatment Effects of a Video Recommendation System for Algebra,2022,Full Paper,Recommendation and Personalization @ Scale,In-person degrees,,Non-CS STEM,Math,N,
Post Recommendation System Impact on Student Participation and Performance in an Online AI Graduate Course,2022,Full Paper,Recommendation and Personalization @ Scale,Online degrees,,CS,AI,N,
"A Scenario-based Exploration of Expected Usefulness, Privacy Concerns, and Adoption Likelihood of Learning Analytics",2022,Full Paper,Analytics @ Scale,Informal Learning Environments,,Unspecified,Survey for learning analytics,N,
"Incorporating Training, Self-monitoring and AI-Assistance to Improve Peer Feedback Quality",2022,Full Paper,Analytics @ Scale,Informal Learning Environments,,Multiple,"To answer the research questions under investigation, we conducted a between subject experiment using two consecutive offerings (Semester 1 and Semester 2) of two undergraduate courses in 2021, namely The Brain and Behavioural Sciences (NEUR) and Introduction to Information Systems (INFS) at the University of Queensland.",N,
RLens: A Computer-aided Visualization System for Supporting Reflection on Language Learning under Distributed Tutorship,2022,Full Paper,Analytics @ Scale,Informal Learning Environemnts,,Non-STEM,We evaluated RLens in a between-subjects study with 40 realworld learners by asking them to reflect on their actual learning data,N,
Digital Education For All: Multi-University Study of Increasing Competent Student Admissions at Scale,2022,Full Paper,Academics @ Scale,MOOCs,,CS,"The data used for this study consists of study records containing all the courses a student has taken in a participating university. From this data, we examine the credits and grades accumulated during the first two years of studies for students who have been accepted to the computer science program in 2019 or 2020. ",Y,"In this work, we report results from a multi-university project in which the open university admission path has been expanded. All the universities in the Digital Educa tion For All (DEFA) project remarkably expanded their portfolio of MOOCsthat were offered both openly and for free, and the new admission path was simultaneously actively marketed and modi f ied."
"Meet Me in the Middle: Retention in a ""MOOC-Based"" Degree Program",2022,Full Paper,Academics @ Scale,Online degrees,,CS,"In order to address our research questions, we obtained a dataset of every individual program enrollment over the program’s seven-year history, from the initial incoming class in Spring 2014 through the Summer 2021 semester. Each element represents a single student enrolling in a single class for a particular semester. ",N,
Function Names: Quantifying the Relationship Between Identifiers and Their Functionality to Improve Them,2022,Full Paper,CS Education @ Scale,In-person degrees,,CS,"In this study, we gathered 5,400 programs from students who attended CS1 in four different course offerings",N,
LEGenT: Localizing Errors and Generating Testcases for CS1,2022,Full Paper,CS Education @ Scale,In-person degrees,,CS,CS1,N,
Using NLP to Quantify Program Decomposition in CS1,2022,Full Paper,CS Education @ Scale,In-person degrees,,CS,CS1,N,
Large-Scale Student Data Reveal Sociodemographic Gaps in Procrastination Behavior,2022,Full Paper,Studies @ Scale,In-person degrees,,Multiple,We obtain all historical LMS data with deidentified student IDs from the university’s IT office and focus on assignment submission records,Y,"Pro crastination, the act of deferring study effort until the task deadline, is therefore a prevalent phenomenon, but whether it is more com mon among historically disadvantaged students is unknown. If systematic differences in procrastination behavior exist across so ciodemographic groups, they may also contribute to achievement gaps, considering that procrastination is largely negatively associ ated with academic performance in prior research. We therefore investigate these questions in the context of assignment submis sion using campus-wide learning management system (LMS) data from a large U.S. research university."
Meta Transfer Learning for Early Success Prediction in MOOCs,2022,Full Paper,Studies @ Scale,MOOCs,,Multiple,"Our experiments on 26 MOOCs with over 145,000 combined enrollment",N,
Millions and Billions of Views: Understanding Popular Science and Knowledge Communication on Video-Sharing Platforms,2022,Full Paper,Video Use @ Scale,Informal Learning Environments,,Multiple,"Videos of computer science, popular science, and learning second languages",N,
Picturing One's Self: Camera Use in Zoom Classes during the COVID-19 Pandemic,2022,Full Paper,Video Use @ Scale,Online degrees,,Multiple,Multiple subjects,N,
Using the YouTube Video Style in a MOOC: (Re-)Testing the Effect of Visual Experience in a Field-Experiment,2022,Full Paper,Video Use @ Scale,MOOCs,,CS,"the given study analyzes results of a field-experiment in a German MOOC with 2,938 active participants taking a four-week course on data structures and algorithms",N,
"Designing and Building Inclusive, Entry-level Massive Open Online Courses (MOOCs): Perspectives from Producers",2022,Full Paper,Instructional Design @ Scale,MOOCs,,Unspecified,Interviews were conducted,Y,"The interviews focus on how these producers are considering traditionally underrepresented learners and the challenges these students may face throughout the design process. The interviews and analysis contribute several observations. First, diverse conceptions of inclusion reflect a sincere normative commitment on the part of the producers to make inclusive MOOCs, though the conceptions were quite distinct. Second, producers were intentional about utilising best-practice pedagogical methods, as well as innovative program design, to include as many learners as possible."
When Gamification Spoils Your Learning: A Qualitative Case Study of Gamification Misuse in a Language-Learning App,2022,Full Paper,Instructional Design @ Scale,Informal Learning Environments,,Non-STEM,Duolingo,N,
Digital Clinical Simulation Suite: Specifications and Architecture for Simulation-Based Pedagogy at Scale,2022,Full Paper,Simulations and Games @ Scale,Informal Learning Environments,,Unspecified,"DCSS simulations collect data about participant behaviors, attitudes, and performance that can be used to formatively assess learning and inform instructional design and refinement.",N,
The Challenges of Evolving Technical Courses at Scale: Four Case Studies of Updating Large Data Science Courses,2022,Full Paper,Simulations and Games @ Scale,Online degrees,,CS,Data Science,N,
Learnersourcing in Theory and Practice: Synthesizing the Literature and Charting the Future,2022,Full Paper,Students @ Scale,Informal Learning Environments,,CS,Designing,N,
Pathways: Exploring Academic Interests with Historical Course Enrollment Records,2022,Full Paper,Students @ Scale,Informal Learning Environments,,Unspecified,,N,
$1 Conversational Turn Detector: Measuring How Video Conversations Affect Student Learning in Online Classes,2016,Full Paper,Learner Modelling,MOOCs,,Unspecified,"This paper presents results from 1,027 participants that used Talkabout to participate in 392 discussion groups",N,
A Constructionist Toolkit for Learning Elementary Web Development at Scale,2016,WIP,Work in Progress,Informal Learning Environments,,CS,We describe the design rationale and principles of a web authoring tool for beginner web developers called Snowball.,N,
A Data-Driven Approach for Inferring Student Proficiency from Game Activity Logs,2016,Full Paper,Automated Assessment,Other,,Unspecified,,N,
A Framework for Topic Generation and Labeling from MOOC Discussions,2016,WIP,Work in Progress,MOOCs,,CS,"For this study, we selected two MOOCs offered in English and none selfpaced: Machine Learning (ML) course (Stanford University – 10 weeks) and Statistics – Making sense of data (STAT) course (University of Toronto – 8 weeks) (Table 1).",N,
"A Preliminary Look at MOOC-associated Facebook Groups: Prevalence, Geographic Representation, and Homophily",2016,WIP,Work in Progress,MOOCs,,Multiple,,N,
A Queueing Network Model for Spaced Repetition,2016,WIP,Work in Progress,Informal Learning Environments,,Unspecified,Network proposal ,N,
A Scalable Learning Analytics Platform for Automated Writing Feedback,2016,WIP,Work in Progress,Informal Learning Environments,,Non-STEM,,N,
ASSISTments Dataset from Multiple Randomized Controlled Experiments,2016,WIP,Work in Progress,Informal Learning Environments,,Non-CS STEM,We present a dataset consisting of data generated from 22 previously and currently running randomized controlled experiments inside the ASSIStments online learning platform. ASSISTments is a freely available online learning platform mostly used in mathematic classes between grades 4-12 in the United States.,N,
AXIS: Generating Explanations at Scale with Learnersourcing and Machine Learning,2016,Full Paper,Flipped Session - Crowdsourcing the Feedback,Informal Learning Environments,,Non-CS STEM,,N,
An Exploration of Automated Grading of Complex Assignments,2016,Full Paper,Automated Assessment,MOOCs,,Unspecified,,N,
An Investigation of the Effects of Online Test Strategy on Students' Learning Behaviors,2016,WIP,Work in Progress,MOOCs,,Multiple,,N,
Assessing Problem-Solving Process At Scale,2016,WIP,Work in Progress,K-12,,Multiple,,N,
Automatically Learning to Teach to the Learning Objectives,2016,WIP,Work in Progress,Other,,CS,,N,
Beetle-Grow: An Effective Intelligent Tutoring System for Data Collection,2016,WIP,Work in Progress,Informal Learning Environments,,Multiple,,N,
Beyond Traditional Metrics: Using Automated Log Coding to Understand 21st Century Learning Online,2016,WIP,Work in Progress,MOOCs,,CS,,N,
Brain Points: A Deeper Look at a Growth Mindset Incentive Structure for an Educational Game,2016,Full Paper,Engagement,Informal Learning Environments,,Non-CS STEM,Refraction math game,N,
Bringing Non-programmer Authoring of Intelligent Tutors to MOOCs,2016,WIP,Work in Progress,MOOCs,,Unspecified,,N,
Browser Language Preferences as a Metric for Identifying ESL Speakers in MOOCs,2016,WIP,Work in Progress,MOOCs,,CS,,Y,"the majority of MOOCs are deployed in English, which can pose an accessibility problem for students with English as a Second Language (ESL). In order to design appropriate interventions for ESL speakers, it is important to correctly identify these students using a method that is scalable to the high number of MOOC enrollees."
"Challenge and Potential of Fine Grain, Cross-Institutional Learning Data",2016,WIP,Work in Progress,MOOCs,,Non-CS STEM,,N,
Course Builder Skill Maps,2016,WIP,Work in Progress,MOOCs,,CS,,N,
Deep Neural Networks and How They Apply to Sequential Education Data,2016,WIP,Work in Progress,MOOCs,,Multiple,,N,
Designing Videos with Pedagogical Strategies: Online Students' Perceptions of Their Effectiveness,2016,WIP,Work in Progress,MOOCs,,Multiple,AI,N,
Designing for Open Learning: Design Principles and Scalability Affordances in Practice,2016,WIP,Work in Progress,MOOCs,,Non-STEM,,N,
Effects of In-Video Quizzes on MOOC Lecture Viewing,2016,Full Paper,Engagement,MOOCs,,Non-CS STEM,,N,
Elice: An online CS Education Platform to Understand How Students Learn Programming,2016,WIP,Work in Progress,Other,"Elice captures detailed student learning activities, such as the intermediate revisions of code as students make progress toward completing their programming exercises. With those data, Elivate recognizes each student’s progression through an education taxonomy which organizes intermediate stages of learning such that the taxonomy can be used to evaluate student progress as well as to design and improve course materials and structure.",Multiple,,N,
Enabling Schema Agnostic Learning Analytics in a Service-Oriented MOOC Platform,2016,WIP,Work in Progress,MOOCs,,Multiple,,N,
Evaluating the 'Student' Experience in MOOCs,2016,WIP,Work in Progress,MOOCs,,Unspecified,,N,
Expert Evaluation of 300 Projects per Day,2016,WIP,Work in Progress,MOOCs,,Non-STEM,,N,
Explaining Student Behavior at Scale: The Influence of Video Complexity on Student Dwelling Time,2016,Full Paper,Engagement,MOOCs,,Unspecified,Video analytics,N,
Exploring the Effects of Lightweight Social Incentives on Learner Performance in MOOCs,2016,WIP,Work in Progress,MOOCs,,CS,,N,
Fuzz Testing Projects in Massive Courses,2016,Full Paper,Automated Assessment,MOOCs,,Unspecified,,N,
Graders as Meta-Reviewers: Simultaneously Scaling and Improving Expert Evaluation for Large Online Classrooms,2016,Full Paper,Flipped Session - Crowdsourcing the Feedback,MOOCs,,Unspecified,,N,
How Mastery Learning Works at Scale,2016,Full Paper,Learner Modelling,Other,Analysis of mastery learning at scale,Non-STEM,,N,
Identifying Student Misunderstandings using Constructed Responses,2016,WIP,Work in Progress,Other,Analysis of misunderstanding,Non-STEM,,N,
Illusion of Progress is Moar Addictive than Cat Pictures,2016,WIP,Work in Progress,Other,Analysis of progress bar through visualizations,CS,,N,
Improving the Peer Assessment Experience on MOOC Platforms,2016,Full Paper,Flipped Session - Crowdsourcing the Feedback,MOOCs,,Non-STEM,,N,
Investigating the Use of Hints in Online Problem Solving,2016,WIP,Work in Progress,MOOCs,,CS,,N,
LINK-REPORT: Outcome Analysis of Informal Learning at Scale,2016,WIP,Work in Progress,Informal Learning Environment,,Unspecified,,N,
Learning Student and Content Embeddings for Personalized Lesson Sequence Recommendation,2016,WIP,Work in Progress,Other,Learning student and content embeddings,Non-STEM,,N,
Learning Transfer: Does It Take Place in MOOCs? An Investigation into the Uptake of Functional Programming in Practice,2016,Full Paper,Flipped Session - Outside the MOOC,MOOCs,,Unspecified,,N,
Learning about Teaching in Low-Resource Indian Contexts,2016,WIP,Work in Progress,Other,Analysis,Multiple,Math and English,Y,We propose the deployment of such an environment in low-resource after-school settings across India. We draw on preliminary research conducted in summer 2015 that leveraged existing ties with an NGO working across 35 after-school classrooms
Learning at Scale: Using an Evidence Hub To Make Sense of What We Know,2016,WIP,Work in Progress,MOOCs,,CS,,N,
Macro Data for Micro Learning: Developing the FUN! Tool for Automated Assessment of Learning,2016,WIP,Work in Progress,Other,,Multiple,,N,
Making the Production of Learning at Scale More Open and Flexible,2016,WIP,Work in Progress,Other,Activity Theory Case Study,Multiple,,N,
Metaphors for Learning and MOOC Pedagogies,2016,WIP,Work in Progress,MOOCs,,Non-CS STEM,,N,
Mobile Devices for Early Literacy Intervention and Research with Global Reach,2016,Full Paper,Global Village,K-12,,Unspecified,,Y,"Little attention is afforded to non-literate populations, particularly in the developing world. This paper presents an approach using mobile devices with the ultimate goal to reach 770 million people. We developed a novel platform with a cloud backend to deliver educational content to over a thousand marginalized children in different countries: specifically, in remote villages without schools, urban slums with overcrowded schools, and at-risk, rural schools."
Modeling Student Scheduling Preferences in a Computer-Based Testing Facility,2016,WIP,Work in Progress,Other,Modelling,Non-CS STEM,,N,
Observing URL Sharing Behaviour in Massive Online Open Courses,2016,WIP,Work in Progress,MOOCs,,CS,,N,
Online Urbanism: Interest-based Subcultures as Drivers of Informal Learning in an Online Community,2016,Full Paper,Global Village,Informal Learning Environment,,CS,,N,
Open-DLAs: An Open Dashboard for Learning Analytics,2016,WIP,Work in Progress,MOOCs,,CS,,N,
Optimally Discriminative Choice Sets in Discrete Choice Models: Application to Data-Driven Test Design,2016,WIP,Work in Progress,MOOCs,,CS,,N,
Optimizing the Amount of Practice in an On-Line Platform,2016,WIP,Work in Progress,Other,Optimization of the amount of time required for practice by students ,Unspecified,,N,
PEER Support In MOOCs: The Role Of Social Presence,2016,WIP,Work in Progress,MOOCs,,CS,,N,
Peer Grading in a Course on Algorithms and Data Structures: Machine Learning Algorithms do not Improve over Simple Baselines,2016,Full Paper,Automated Assessment,MOOCs,,CS,,N,
Peer Reviewing Short Answers using Comparative Judgement,2016,WIP,Work in Progress,Other,,Multiple,,N,
Personalized Adaptive Learning using Neural Networks,2016,WIP,Work in Progress,Other,,Non-STEM,,N,
Predicting Student Learning using Log Data from Interactive Simulations on Climate Change,2016,WIP,Work in Progress,Other,,CS,,N,
Predicting Students' Performance: Incremental Interaction Classifiers,2016,WIP,Work in Progress,Other,,CS,,N,
Predicting Students' Standardized Test Scores Using Online Homework,2016,WIP,Work in Progress,K-12,,CS,,N,
Profiling MOOC Course Returners: How Does Student Behavior Change Between Two Course Enrollments?  269-272,2016,WIP,Work in Progress,MOOCs,,Non-CS STEM,,N,
Promoting Student Engagement in MOOCs,2016,WIP,Work in Progress,MOOCs,,CS,,N,
Recommending Self-Regulated Learning Strategies Does Not Improve Performance in a MOOC,2016,WIP,Work in Progress,MOOCs,,Unspecified,,N,
Scaling up Online Question Answering via Similar Question Retrieval,2016,WIP,Work in Progress,MOOCs,,Multiple,,N,
Structured Knowledge Tracing Models for Student Assessment on Coursera,2016,WIP,Work in Progress,MOOCs,,Unspecified,,N,
Supporting Peer Instruction with Evidence-Based Online Instructional Templates,2016,WIP,Work in Progress,MOOCs,,CS,,N,
Supporting Scalable Data Sharing in Online Education,2016,WIP,Work in Progress,MOOCs,,Non-STEM,,N,
TAPS: A MOSS Extension for Detecting Software Plagiarism at Scale,2016,WIP,Work in Progress,Online degrees,,CS,,N,
The Civic Mission of MOOCs: Measuring Engagement across Political Differences in Forums,2016,Full Paper,Global Village,MOOCs,,Non-CS STEM,,N,
The Distributed Esteemed Endorser Review: A Novel Approach to Participant Assessment in MOOCs,2016,WIP,Work in Progress,MOOCs,,Unspecified,,N,
The Opportunity Count Model: A Flexible Approach to Modeling Student Performance,2016,WIP,Work in Progress,Other,,Non-CS STEM,,N,
The Role of Social Media in MOOCs: How to Use Social Media to Enhance Student Retention,2016,Full Paper,Flipped Session - Outside the MOOC,MOOCs,,Non-CS STEM,,N,
The Unexpected Pedagogical Benefits of Making Higher Education Accessible,2016,WIP,Work in Progress,Online degrees,,Non-CS STEM,,Y,"Many ongoing efforts in online education aim to increase accessibility through affordability and flexibility, but some critics have noted that pedagogy often suffers during these efforts. In contrast, in the low-cost for-credit Georgia Tech Online Masters of Science in Computer Science (OMSCS) program, we have observed that the features that make the program accessible also lead to pedagogical benefits."
Towards Cross-domain MOOC Forum Post Classification,2016,WIP,Work in Progress,MOOCs,,Unspecified,,N,
Understanding ESL Students' Motivations to Increase MOOC Accessibility,2016,WIP,Work in Progress,MOOCs,,Non-CS STEM,,Y,"MOOCs in their present state, however, may be relatively inaccessible to non-native English speakers, as a majority of MOOC content is in the English language. While a potential solution is to translate all MOOC content into all languages, it is not known whether this solution will satisfy the learning goals of all English as a Second Language (ESL) speakers. Through a series of interviews, we investigate ESL speakers’ motivations for taking MOOCs and other online courses."
Using Android Wear for Avoiding Procrastination Behaviours in MOOCs,2016,WIP,Work in Progress,MOOCs,,Unspecified,,N,
Using Multiple Accounts for Harvesting Solutions in MOOCs,2016,Full Paper,Learner Modelling,MOOCs,,CS,,N,
Work in Progress: Student Behaviors Using Feedback in a Blended Physics Undergraduate Classroom,2016,WIP,Work in Progress,MOOCs,,Non-CS STEM,,N,
A Crowdsourcing Approach to Collecting Tutorial Videos - Toward Personalized Learning-at-Scale,2017,WIP,Work in Progress,Other,,Multiple,,N,
A Heuristic Method for Large-Scale Cognitive-Diagnostic Computerized Adaptive Testing,2017,WIP,Work in Progress,Other,,CS,,N,
A Memory-Augmented Neural Model for Automated Grading,2017,WIP,Work in Progress,MOOCs,,Unspecified,,N,
A Novel Self-Paced Model for Teaching Programming,2017,WIP,Work in Progress,Other,,Unspecified,,N,
A Probabilistic Approach for Discovering Difficult Course Topics Using Clickstream Data,2017,WIP,Work in Progress,MOOCs,,Non-CS STEM,,N,
A Statistical Framework for Predictive Model Evaluation in MOOCs,2017,WIP,Work in Progress,MOOCs,,Non-CS STEM,,N,
A Visual Approach towards Knowledge Engineering and Understanding How Students Learn in Complex Environments,2017,Full Paper,Engineering Learning Environments,Informal Learning Environment,,Unspecified,,N,
Access to Massive Open Online Labs through a MOOC,2017,WIP,Work in Progress,MOOCs,,Unspecified,,N,
Applying and Exploring Bayesian Hypothesis Testing for Large Scale Experimentation in Online Tutoring Systems,2017,WIP,Work in Progress,Other,,Non-STEM,,N,
Authentic Science Inquiry Learning at Scale Enabled by an Interactive Biology Cloud Experimentation Lab,2017,WIP,Work in Progress,MOOCs,,CS,,N,
CROWDLEARNING: Towards Collaborative Problem-Posing at Scale,2017,WIP,Work in Progress,Other,,Unspecified,,N,
Characterizing ELL Students' Behavior During MOOC Videos Using Content Type,2017,WIP,Work in Progress,MOOCs,,CS,,Y,"We show that ELL students exhibit distinct struggle behaviors in video portions without visual aids e.g., narrations without slides. Our findings challenge widely accepted multimedia design principles such as the split attention effect, provide insights into designing MOOC videos, and emphasize the need for adaptivity to increase MOOC access for ELLs."
Collaboration and Teamwork on a MOOC Platform: A Toolset,2017,WIP,Work in Progress,MOOCs,,CS,,N,
Comment Ranking Diversification in Forum Discussions,2017,WIP,Work in Progress,MOOCs,,Unspecified,,N,
"Congruency, Adaptivity, Modularity, and Personalization: Four Experiments in Teaching Introduction to Computing",2017,WIP,Work in Progress,MOOCs,,Non-CS STEM,,N,
Criteria for Video Engagement in a Biology MOOC,2017,WIP,Work in Progress,MOOCs,,Multiple,,N,
Data-mining textual responses to uncover misconception patterns,2017,WIP,Work in Progress,MOOCs,,CS,,N,
Data-Driven Feedback Generator for Online Programing Courses,2017,WIP,Work in Progress,MOOCs,,CS,,N,
Deep Knowledge Tracing On Programming Exercises,2017,WIP,Work in Progress,MOOCs,,CS,,N,
Designing Adaptive Assessments in MOOCs,2017,WIP,Work in Progress,MOOCs,,Unspecified,,N,
Detecting Diligence with Online Behaviors on Intelligent Tutoring Systems,2017,Full Paper,Predicting and Explaining Learning,Other,,Programming,,N,
Do Performance Trends Suggest Wide-spread Collaborative Cheating on Asynchronous Exams?  111-120,2017,Full Paper,Integrity of Courses and Learners,In-person degrees,,Programming,,N,
Enabling Real-Time Adaptivity in MOOCs with a Personalized Next-Step Recommendation Framework,2017,Full Paper,Engineering Learning Environments,MOOCs,,Unspecified,,N,
Enhancing the Experience Application Program Interface (xAPI) to Improve Domain Competency Modeling for Adaptive Instruction,2017,WIP,Work in Progress,Other,,Multiple,,N,
Epistemic Cognition: A Promising and Necessary Construct for Enriching Large-scale Online Learning Analysis,2017,Full Paper,Predicting and Explaining Learning,MOOCs,,Unspecified,,N,
