Two views of scale: Design Principles for Scaling Reach and Empowerment,2019,Full Paper,Learning Support,Other,,Unspecified,,Y,"Extended learning support systems for all-age education requires inclusive user interface design, especially for elderly users."
Apples to Apples: Differences in Viewer Retention When Longer Content is Chopped into Smaller Bites,2019,Full Paper,Learning Support,MOOCs,,Unspecified,,N,
Key Phrase Extraction for Generating Educational Question-Answer Pairs,2019,Full Paper,Learning Support,Other,,CS,,N,
Master’s at Scale: Five Years in a Scalable Online Graduate Degree,2019,Full Paper,L@S Perspectives,Online degrees,,CS,,Y,"The on-campus program hovers around 27% women, although that number has declined seemingly  steadily the past five semesters. The online program began at 9% women but has steadily climbed to 17%. The on-campus program hovers consistently around 7% underrepresented minorities, while the online program has held relatively steady (or decreasing slightly) around 13%. "
Data-Assistive Course-to-Course Articulation Using Machine Translation,2019,Full Paper,L@S Perspectives,Other,,CS,,N,
Via: Illuminating Academic Pathways at Scale,2019,Full Paper,L@S Perspectives,Other,,CS,,N,
Predict and Intervene: Addressing the Dropout Problem in a MOOC-based Program,2019,Full Paper,L@S Perspectives,MOOCs,,CS,,N,
Chimeria:Grayscale MOOC: Towards Critical Self-Reflection at Scale,2019,WIP,,MOOCs,,Non-CS STEM,,N,
Measuring Students’ Performance on Programming Tasks,2019,WIP,,Other,,Unspecified,,N,
Informing the Design of Collaborative Activities in MOOCs using Actionable Predictions,2019,WIP,,MOOCs,,Unspecified,,N,
Measuring Difficulty of Introductory Programming Tasks,2019,WIP,,Other,,CS,,N,
Inquiry learning at scale: pedagogy-informed design of a platform for citizen inquiry,2019,WIP,,Other,,Non-CS STEM,,Y,"It is a ‘scale-enhanced’ pedagogy where learners engage with shared artefacts (nQuire missions) to satisfy mutually-beneficial goals (for mission authors, to run a scientific study that satisfies a felt difficulty or curiosity; for participants, to contribute to citizen science, to receive feedback on results, to engage with other participants, and to have opportunities to create their own missions)."
BookBuddy: Turning Digital Materials Into Interactive Foreign Language Lessons Through a Voice Chatbot,2019,WIP,,Other,,Unspecified,,N,
Creating a Framework for User-Centered Development and Improvement of Digital Education,2019,WIP,,Other,,Unspecified,,N,
Leveraging Skill Hierarchy for Multi-Level Modeling with Elo Rating System,2019,WIP,,Other,,Multiple,,N,
Student Code Trajectories in an Introductory Programming MOOC,2019,WIP,,MOOCs,,Non-CS STEM,,N,
Predicting the difficulty of automatic item generators on exams from their difficulty on homeworks,2019,WIP,,Other,,Non-CS STEM,,N,
Pilot Study to Estimate “Difficult” Area in e-Learning Material by Physiological Measurements,2019,WIP,,Other,,Non-CS STEM,,N,
Semantic Matching Evaluation of User Responses to Electronics Questions in AutoTutor,2019,WIP,,Other,,Unspecified,,N,
Proposal and Implementation of an Elderly-oriented User Interface for Learning Support Systems,2019,WIP,,Other,,Unspecified,,Y,"Extended learning support systems for all-age education requires inclusive user interface design, especially for elderly users."
Implementing Learning Analytics to Foster a STEM Learning Ecosystem at the City-Level: Emerging Research and Design Challenges,2019,WIP,,Other,,Non-CS STEM,,N,
On the Influence of Grades on Learning Behavior of Students in MOOCs,2019,WIP,,MOOCs,,CS,,N,
Synchronous at Scale: Investigation and Implementation of a Semi-Synchronous Online Lecture Platform,2019,WIP,,Online degrees,,CS,,N,
Impact of Free-Certificate Coupons on Learner Behavior in Online Courses: Results from Two Case Studies,2019,WIP,,MOOCs,,CS,,Y,"Our findings suggest that consumers of MOOC-based tech nologies are price-sensitive; a reduction of only US$49 in cost was linked to a tripling of verified registration in Case Study #1. Additionally in Case Study #2, when the cost of the course was US$3900, more women, students over 50, and students in the US, participated in the free-certificate track than in the paid-certificate track. This suggests that these participants may be particularly price sensitive and thus more likely to sign-up for a certificate track if they do not need to pay for it."
Guided-KNOWLA: The Use of Guided Unscrambling to Enhance Active Online Learning,2019,WIP,,Other,,CS,,N,
An Automated Feedback System to Support Student Learning in Writing-to-Learn Activities,2019,WIP,,Other,,Unspecified,,N,
automaTA: Human-Machine Interaction for Answering Context-Specific Questions,2019,WIP,,Other,,CS,,N,
What do students at distance universities think about AI?,2019,WIP,,Other,,CS,,N,
Peer Advising at Scale: Content and Context of a LearnerOwned Course Evaluation System,2019,WIP,,Online degrees,,Multiple,,N,
Towards Improving Students’ Forum Posts Categorization in MOOCs and Impact on Performance Prediction,2019,WIP,,MOOCs,,Non-STEM,,N,
PARQR: Augmenting the Piazza Online Forum to Better Support Degree Seeking Online Masters Students,2019,WIP,,Online degrees,,CS,,N,
Causal Inference in Higher Education: Building Better Curriculums,2019,WIP,,Other,,CS,,N,
Investigating Learning Design Categorization and Learning Behaviour in Computational MOOCS,2019,WIP,,MOOCs,,CS,,N,
LiveDataLab: A Cloud-Based Platform to Facilitate Hands-on Data Science Education at Scale,2019,WIP,,Other,,Non-CS STEM,,N,
Jack Watson: Addressing Contract Cheating at Scale in Online Computer Science Education,2019,WIP,,Other,,CS,,N,
Developing an Intervention to Advance Learning At Scale,2019,WIP,,MOOCs,,Unspecified,,N,
Web of Slides: Automatic Linking of Lecture Slides to Facilitate Navigation,2019,WIP,,MOOCs,,Multiple,,N,
WOSView Demo: A Tool to Explore the Web of Slides,2019,WIP,,Others,,Unspecified,,N,
Teaching C Programming Interactively at Scale Using Taskgrader: an Open-source Autograder Tool.,2019,WIP,,Other,,CS,,N,
Supporting Instruction of Formulaic Sequences Using Videos at Scale,2019,WIP,,Other,,Non-STEM,,N,
Achievements for building a learning community,2019,WIP,,Other,,CS,,N,
Investigating the Impact of Skill-Related Videos on Online Learning,2023,Full Paper,Assessment @ Scale,Other ,,Non-CS STEM,,N,
LENS: Predictive Diagnostics for Flexible and Efficient Assessments,2023,Full Paper,Assessment @ Scale,Other ,,Unspecified,,N,
Crowdsourcing the Evaluation of Multiple-Choice Questions Using Item-Writing Flaws and Bloom’s Taxonomy,2023,Full Paper,Assessment @ Scale,Other,,Non-CS STEM,,N,
All A-board: Sharing Educational Data Science Research With School Districts,2023,Full Paper,Fairness and Equity @ Scale,Other ,,Non-CS STEM,,Y,Focusing on one en trenched educational equity issue in US public schools—racial and ethnic segregation—we conduct randomized email outreach exper iments and surveys to explore how local school districts respond to algorithmically-generated school catchment areas (“attendance boundaries”) designed to foster more diverse and integrated schools.
Assessing the Fairness of Course Success Prediction Models in the Face of (Un)equal Demographic Group Distribution,2023,Full Paper,Fairness and Equity @ Scale,Other ,,Non-CS STEM,,Y,"Nevertheless, it has become important to consider fairness as an integral part of the criteria for model selection. Might a model be unfair towards cer tain demographic groups? Might it systematically perform poorly for certain demographic groups?"
M-Powering Teachers: Natural Language Processing Powered Feedback Improves 1:1 Instruction and Student Outcomes,2023,Full Paper,Feedback @ Scale,Other ,,Unspecified,,N,
How Common are Common Wrong Answers? Crowdsourcing Remediation at Scale,2023,Full Paper,Feedback @ Scale,Other ,,Non-CS STEM,,N,
High-Resolution Course Feedback: Timely Feedback Mechanism for Instructors,2023,Full Paper,Feedback @ Scale,Other ,,Unspecified,,N,
From Answering for Points to Commenting for Others An Examination of the Posting Behaviors of High-reputation-score Users of Stack Overflow,2023,Full Paper,Informal Learning @ Scale,Other ,,CS,,N,
The Relevance of Ivan Illich’s Learning Webs 50 Years On,2023,Full Paper,Informal Learning @ Scale,Other ,,Non-CS STEM,,Y,"By trying to provide the disadvantaged access to the same re sources as the advantaged—resources that they may not use even if they are given access to them—we may forgo the opportunity to rethink how we design equitable and powerful learning envi ronments from the ground up, building on themes we discussed in Sections 3.2 and 3.3."
Exploring Students’ Perceptions and Engagement in Hybrid Flexible Courses,2023,Full Paper,Instruction @ Scale,Other ,,Multiple,,N,
Managing TAs at Scale: Investigating the Experiences of Teaching Assistants in Introductory Computer Science,2023,Full Paper,Instruction @ Scale,Other ,,CS,,N,
"How Learning Experience Designers Make Design Decisions: The Role of Data, the Reliance on Subject Matter Expertise, and the Opportunities for Data-Driven Support",2023,Full Paper,Instruction @ Scale,Other ,,Unspecified,,N,
Teaching at Scale and Back Again,2023,Full Paper,Instruction @ Scale,Other ,,Unspecified,,N,
How Teachers Influence Student Adoption and Effectiveness of a Recommendation System for Algebra,2023,Full Paper,Instruction @ Scale,Other ,,Non-CS STEM,,N,
Benefit of Gamification for Persistent Learners: Propensity to Replay Problems Moderates Algebra-Game Effectiveness,2023,Full Paper,Instruction @ Scale,Other ,,Non-CS STEM,,N,
How to Open Science: Analyzing the Open Science Statement Compliance of the Learning @ Scale Conference,2023,Full Paper,Open Science @ Scale,Other ,,Unspecified,,N,
Exploring Cross-Country Prediction Model Generalizability in MOOCs,2023,Full Paper,Prediction @ Scale,MOOCs,,Unspecified,,Y,"This paper presents an exploration into the role of nation-level metrics of culture, happiness, wealth, and size on the generalizability of completion prediction models across countries. The findings indicate that various dimensions of culture are predictive of cross-country model generalizability. Specifically, learners from indulgent, collectivist, uncertainty accepting, or short-term oriented, countries produce more generalizable predictive models of learner completion."
Evaluating a Learned Admission-Prediction Model as a Replacement for Standardized Tests in College Admissions,2023,Full Paper,Prediction @ Scale,Other ,,Non-STEM,,Y,"Second, we note that our subgroup analysis only considered a limited number of applicant subgroups, specifically female, URM, andlegacy applicants. While our analysis provides valuable insights about the model behavior for some key subgroups, we recognize that it does not provide a comprehensive understanding of the prediction model’s impact on specific racial and ethnic groups, and other important subgroups such as international, low-SES, and first generation applicants."
EliRank: A Code Editing History Based Ranking Model for Early Detection of Students in Need,2023,Full Paper,Prediction @ Scale,Other ,,CS,,N,
Convincing the Expert: Reducing Algorithm Aversion in Administrative Higher Education Decision-making,2023,Full Paper,Systems and tools @ Scale,Other ,,Unspecified,,N,
GPTeach: Interactive TA Training with GPT-based Students,2023,Full Paper,Systems and tools @ Scale,Other ,,CS,,N,
Supporting Online Collaborative Work at Scale: A Mixed-Methods Study of a Learning Analytics Tool,2023,Full Paper,Systems and tools @ Scale,Other ,,CS,,N,
A Novel Approach for Knowledge State Representation and Prediction,2020,Full Paper,Work-in-Progress/Demonstration Session,Other,,Unspecified,,N,
A Quantitative Analysis of When Students Choose to Grade Questions on Computerized Exams with Multiple Attempts,2020,Full Paper,Work-in-Progress/Demonstration Session,Other,,Non-CS STEM,,N,
Adaptive Learning using Finite State Machine Logic,2020,Full Paper,Work-in-Progress/Demonstration Session,Other,,Multiple,,N,
Affordable Degrees at Scale: New Phenomenon or New Hype?  25-35,2020,Full Paper,Session 1,Online degrees,,CS,,Y,"In this research, we set out to understand this space: the range in tuition costs for these programs, the variety of admissions standards, and the types of assessments used to evaluate these non-traditional students. In the process, however, we found that in many ways, these programs may not be as new as we initially perceived: similarly-priced online programs have existed from traditional universities for years."
AlgoPlan: Supporting Planning in Algorithmic Problem-Solving with Subgoal Diagrams,2020,Full Paper,Work-in-Progress/Demonstration Session,Other,,CS,,N,
An Evidence-Based Learner Model for Supporting Activities in Robotics,2020,Full Paper,Work-in-Progress/Demonstration Session,Other ,,CS,,N,
Analysis of Grading Times of Short Answer Questions,2020,Full Paper,Work-in-Progress/Demonstration Session,Other,,Unspecified,,N,
Analyzing K-12 Blended MOOC Learning Behaviors,2020,Full Paper,Work-in-Progress/Demonstration Session,MOOCs; K-12,,Programming,,N,
Analyzing Pre-Existing Knowledge and Performance in a Programming MOOC,2020,Full Paper,Work-in-Progress/Demonstration Session,MOOCs,,Programming,,N,
Artificial Intelligence for Video-based Learning at Scale,2020,Full Paper,Workshops,Other,,Unspecified,,N,
Automated Generation of Learning Paths at Scale,2020,Full Paper,Work-in-Progress/Demonstration Session,Other,,Multiple,,N,
Automatic RNN Cell Design for Knowledge Tracing using Reinforcement Learning,2020,Full Paper,Work-in-Progress/Demonstration Session,Other,,Unspecified,,N,
BELT: Bluejeans codE Leak deTection,2020,Full Paper,Work-in-Progress/Demonstration Session,Other,,CS,,N,
Building an Infrastructure for Computer Science Education Research and Practice at Scale,2020,Full Paper,Workshops,Other,,CS,,N,
Challenges of Online Learning in Nigeria,2020,Full Paper,Work-in-Progress/Demonstration Session,MOOCs,,Unspecified,,Y,"In this work, Socioeconomic, Sociocultural, and IT infrastructural factors are categorized as challenges hindering the adoption of online learning in Nigeria. Although some factors mitigating online learning have been identified in the past, there is relatively little empirical evidence indicating the reality and severity of these challenges."
Characterizing Teacher Connections in Online Social Media: A Case Study on Pinterest,2020,Full Paper,Work-in-Progress/Demonstration Session,K-12,,Unspecified,,N,
Co-Teaching Computer Science Across Borders: Human-Centric Learning at Scale,2020,Full Paper,Session 3,K-12,,CS,,Y,"Over the past six years, the curriculum has been used to teach CS1 material to over 1,000 high school students in Colombia, the Czech Republic, Turkey, and Guinea."
Code Free Chatbot Development: An Easy Way to Jumpstart Your Chatbot!  233-235,2020,Full Paper,Workshops,Other,,Unspecified,,N,
Cold Start Knowledge Tracing with Attentive Neural Turing Machine,2020,Full Paper,Work-in-Progress/Demonstration Session,Other,,Unspecified,,N,
Content Type Distribution and Readability of MOOCs,2020,Full Paper,Work-in-Progress/Demonstration Session,MOOCs,,Multiple,,N,
Designing Inclusive Learning Environments,2020,Full Paper,Workshops,Other,,Multiple,,Y,This workshop aims to advance our understanding of the ways in which adaptivity can be leveraged to buttress inclusivity in STEM learning. Through brief paper presenta tions and collaborative activities we intend to outline design opportunities in the scaled learning space for creating more inclusive environments.
Detecting Contract Cheaters in Online Programming Classes with Keystroke Dynamics,2020,Full Paper,Work-in-Progress/Demonstration Session,Other,,CS,,N,
"Developing Digital Clinical Simulations for Large-Scale Settings on Diversity, Equity, and Inclusion: Design Considerations for Effective Implementation at Scale",2020,Full Paper,Work-in-Progress/Demonstration Session,Other,,Non-STEM,,Y,"Digital clinical simulations (DCSs) are a promising tool for professional learning on diversity, equity, and inclusion (DEI) issues across a variety of fields."
"Differential Assessment, Differential Benefit: Four-year Problem Roulette Analysis of STEM Practice Study",2020,Full Paper,Work-in-Progress/Demonstration Session,Other,,Multiple,,Y,"Across all subjects, we f ind that females gain more grade benefit from high study vol ume than males. Female students also outwork males during prime study hours yet, on average, earn 013 003 lower grade points in chemistry than males with the same response accuracy in practice, with null results in statistics and physics."
Effectiveness of Crowd-Sourcing On-Demand Assistance from Teachers in Online Learning Platforms,2020,Full Paper,Session 3,Other,,Non-CS STEM,,N,
Evaluating Bayesian Knowledge Tracing for Estimating Learner Proficiency and Guiding Learner Behavior,2020,Full Paper,Work-in-Progress/Demonstration Session,Other,,Unspecified,,N,
Examinator: A Plagiarism Detection Tool for Take-Home Exams,2020,Full Paper,Work-in-Progress/Demonstration Session,Other,,CS,,N,
Examining Sources of Variation in Student Confusion in College Classes,2020,Full Paper,Work-in-Progress/Demonstration Session,Other,,Unspecified,,N,
Explanation Mining,2020,Full Paper,Work-in-Progress/Demonstration Session,Other,,Unspecified,,N,
Guidance on How Learning at Scale Can be Made More Accessible,2020,Full Paper,Work-in-Progress/Demonstration Session,MOOCs,,Unspecified,,Y,"In order to gain the view of experts in this area, including MOOC providers and experts in the area of online learning, this study asks: ‘How do expert researchers and practitioners understand accessibility and disability on MOOC platforms?’ and ‘How could courses offered on those platforms be made more accessible to disabled learners?’"
Have Your Tickets Ready! Impede Free Riding in Large Scale Team Assignments,2020,Full Paper,Work-in-Progress/Demonstration Session,MOOCs,,Non-STEM,,N,
Human Languages in Source Code: Auto-Translation for Localized Instruction,2020,Full Paper,Session 5,Other,,CS,,N,
Identifying Preparatory Courses that Predict Student Success in Quantitative Subjects,2020,Full Paper,Work-in-Progress/Demonstration Session,Other,,Unspecified,,N,
Inferring Creativity in Visual Programming Environments,2020,Full Paper,Work-in-Progress/Demonstration Session,Other,,CS,,N,
Informal Learning Communities: The Other Massive Open Online 'C',2020,Full Paper,Session 3,Informal learning environment,,Unspecified,,N,
Interpretable Models Do Not Compromise Accuracy or Fairness in Predicting College Success,2020,Full Paper,Work-in-Progress/Demonstration Session,Other,,Multiple,,Y,"Our findings suggest that more interpretable models such as logistic regression do not necessarily compromise predictive accuracy. Also, they lead to no more, if not less, prediction bias against disadvantaged student groups than complicated models. Moreover, prediction biases against certain groups persist even in the fairest model."
Interpretable Personalized Knowledge Tracing and Next Learning Activity Recommendation,2020,Full Paper,Work-in-Progress/Demonstration Session,Other,,Non-CS STEM,,N,
Introducing Alexa for E-learning,2020,Full Paper,Work-in-Progress/Demonstration Session,Other,,Unspecified,,N,
Learnersourcing at Scale to Overcome Expert Blind Spots for Introductory Programming: A Three-Year Deployment Study on the Python Tutor Website,2020,Full Paper,Work-in-Progress/Demonstration Session,Other,,CS,,N,
Learning Analytics Dashboard for Problem-based Learning,2020,Full Paper,Work-in-Progress/Demonstration Session,Other,,Unspecified,,N,
Learning Engineering @ Scale,2020,Full Paper,Workshops,Other,,Unspecified,,N,
Learning to Cheat: Quantifying Changes in Score Advantage of Unproctored Assessments Over Time,2020,Full Paper,Session 5,Other,,CS,,N,
Leveraging Book Indexes for Automatic Extraction of Concepts in MOOCs,2020,Full Paper,Work-in-Progress/Demonstration Session,MOOCs,,Multiple,,N,
Locabulary: A Context Sensitive Mixed Reality Flashcard Alternative for Second Language Learning,2020,Full Paper,Work-in-Progress/Demonstration Session,Other,,Non-CS STEM,,N,
Open PISA: Dashboard for Large Educational Dataset,2020,Full Paper,Work-in-Progress/Demonstration Session,Other,,Unspecified,,N,
PARQR: Automatic Post Suggestion in the Piazza Online Forum to Support Degree Seeking Online Masters Students,2020,Full Paper,Session 3,Online degrees,,Multiple,,N,
Peripheral and Semi-Peripheral Community: A New Design Challenge for Learning at Scale,2020,Full Paper,Work-in-Progress/Demonstration Session,Other,,Unspecified,,N,
Pixasso: A Development Stage-Based Learning Application for Children,2020,Full Paper,Work-in-Progress/Demonstration Session,Other,,CS,,N,
Predicting Applicant Admission Status for Georgia Tech's Online Master's in Analytics Program,2020,Full Paper,Work-in-Progress/Demonstration Session,Other,,Non-CS STEM,,N,
SAGA: Curricula Optimization,2020,Full Paper,Work-in-Progress/Demonstration Session,Other,,Unspecified,,N,
Sensing Affect to Empower Students: Learner Perspectives on Affect-Sensitive Technology in Large Educational Contexts,2020,Full Paper,Session 2,Other,,Multiple,,N,
Student Engagement in Mobile Learning via Text Message,2020,Full Paper,Session 4,Other,,Unspecified,,Y,"This study examines how 93,819 Kenyan students in grades 6, 9, and 12 use a text message-based mobile learning platform that has millions of users across Sub-Saharan Africa. We investigate longitudinal variation in engagement over a one-year period for students in different age groups and check for evidence of learning gains using learning curve analysis. Student engagement is highest during school holidays and leading up to standardized exams, but persistence over time is low: under 25% of students return to the platform after joining."
Students' Achievement of Personalized Learning Objectives in MOOCs,2020,Full Paper,Session 4,MOOCs,,Multiple,,Y,"Concerning the learners’ socio-demographic and geographical background, we could not identify any practical significant difference between stu dents with selected learning objectives and the total course population. However, we have identified promising objective achievement rates, and we have observed a practical signifi cant improvement of the certification rates comparing the total course population and students who selected an objective that included a graded certificate."
Studying Retrieval Practice in an Intelligent Tutoring System,2020,Full Paper,Session 2,Other,,Non-CS STEM,,N,
Supporting Learners' Self-regulation in LMOOCs: What Have We Done and How Far We Can Go?  207-209,2020,Full Paper,Workshops,MOOCs,,Non-CS STEM,,N,
The Effect of Informing Agency in Self-Directed Online Learning Environments,2020,Full Paper,Session 2,Other,,CS,,N,
The Effectiveness of Multiple-Choice Type Flashcards for the Identification of Fish Species,2020,Full Paper,Work-in-Progress/Demonstration Session,Other,,Non-STEM,,N,
"The Role of Self-Regulated Learning in the Design, Implementation, and Evaluation of Learning Analytics Dashboards",2020,Full Paper,Work-in-Progress/Demonstration Session,Other,,Unspecified,,N,
The Synchronicity Paradox in Online Education,2020,Full Paper,Session 1,Other,,Unspecified,,N,
Toward Learning at Scale in Developing Countries: Lessons from the Global Learning XPRIZE Field Study,2020,Full Paper,Session 5,Other,,Unspecified,,Y,"Advances in education technology are enabling tremendous advances in learning at scale. However, they typically assume resources taken for granted in developed countries, including reliable electricity, high-bandwidth Internet access, fast WiFi, powerful computers, sophisticated sensors, and expert technical support to keep it all working. This paper examines these assumptions in the context of a massive test of learning at scale in a developing country. We examine each assumption, how it was broken, and some workarounds used in a 15-month-long independent controlled evaluation of pre- to posttest learning and social-emotional gains by over 2,000 children in 168 villages in Tanzania. We analyze those gains to characterize who gained how much, using test score data, social-emotional measures, and detailed logs from RoboTutor."
Towards Crowdsourcing the Identification of Knowledge Components,2020,Full Paper,Work-in-Progress/Demonstration Session,Other,,Non-CS STEM,,N,
Towards Scalable Gamified Assessment in Support of Collaborative Problem-Solving Competency Development in Online and Blended Learning,2020,Full Paper,Work-in-Progress/Demonstration Session,K-12,,Non-CS STEM,,N,
"Towards an Appropriate Query, Key, and Value Computation for Knowledge Tracing",2020,Full Paper,Work-in-Progress/Demonstration Session,Other,,Non-CS STEM,,N,
"Two Stances, Three Genres, and Four Intractable Dilemmas for the Future of Learning at Scale",2020,Full Paper,Session 1,Other,,Unspecified,,N,
Understanding Learner Behavior Through Learning Design Informed Learning Analytics,2020,Full Paper,Session 4,Other,,CS,,N,
Understanding Reading Behaviors of Middle School Students,2020,Full Paper,Work-in-Progress/Demonstration Session,K-12,,Multiple,,N,
Understanding Student Experience: A Pathways Model,2020,Full Paper,Work-in-Progress/Demonstration Session,Other,,Unspecified,,N,
Understanding the Implications of the Use of Intelligent Tutoring Systems in Driver Training,2020,Full Paper,Work-in-Progress/Demonstration Session,Other,,Non-STEM,,N,
