Experimenting Choices of Video and Text Feedback in Authentic Foreign Language Assignments at Scale,2017,WIP,Work in Progress,Other,,CS,,N,
Factor Analysis Reveals Student Thinking using the Mechanics Reasoning Inventory,2017,WIP,Work in Progress,Other,,CS,,N,
Formal Forum Triage: Towards the Strategic Selection of Responses to Student Discussion Forums,2017,WIP,Work in Progress,MOOCs,,Unspecified,,N,
Generating Language Activities in Real-Time for English Learners using Language Muse,2017,WIP,Work in Progress,K-12,,Unspecified,,N,
"Getting to Know English Language Learners in MOOCs: Their Motivations, Behaviors, and Outcomes",2017,WIP,Work in Progress,MOOCs,,CS,,Y,"In order to improve accessibility for ELLs in digital learning environments, we must first have a clear understanding of the educational landscape: who are the non-native English speakers enrolled in MOOCs? Where are they located geographically? What are their current online learning behaviors, motivations and outcomes? In this paper we start answering some of these questions by analyzing data from 100 HarvardX courses, using self-report and log data. Preliminary analysis show evidence that ELLs are motivated by more utilitarian goals compared to non-ELLs."
Google BigQuery for Education: Framework for Parsing and Analyzing edX MOOC Data,2017,WIP,Work in Progress,MOOCs,,Unspecified,,N,
"Gradescope: A Fast, Flexible, and Fair System for Scalable Assessment of Handwritten Work",2017,Full Paper,Feedback for Improving Learning,Other,,Unspecified,,N,
Humans and Machines Together: Improving Characterization of Large Scale Online Discussions through Dynamic Interrelated Post and Thread Categorization (DIPTiC),2017,WIP,Work in Progress,MOOCs,,Multiple,,N,
Improving Assessment on MOOCs Through Peer Identification and Aligned Incentives,2017,WIP,Work in Progress,MOOCs,,Multiple,,N,
In-Video Reuse of Discussion Threads in MOOCs,2017,WIP,Work in Progress,MOOCs,,CS,,N,
Incorporating Rich Features into Deep Knowledge Tracing,2017,WIP,Work in Progress,Other,,Non-STEM,,N,
Intelligent Math Tutor: Problem-Based Approach to Create Cognizance,2017,WIP,Work in Progress,Other,,Multiple,,N,
Learning about Learning at Scale: Methodological Challenges and Recommendations,2017,Full Paper,Experimentation,MOOCs,,Non-CS STEM,,N,
Learning to Code in Localized Programming Languages,2017,Full Paper,Learn to Code,Informal Learning Environment,,Unspecified,,Y,"Education research suggests that learning in one’s local lan guage can have a positive impact on learning outcomes. We offer a quantitative test of the association between local lan guage use and the rate at which youth learn to program. Using longitudinal data drawn from five countries and over 15,000 users of Scratch, a large informal learning community, we find that novice users who code with their programming language keywords and environment localized into their home countries’ primary language demonstrate new programming concepts at a faster rate than users from the same countries whose in terface is in English."
Long-Term Peer Reviewing Effort is Anti-Reciprocal,2017,WIP,Work in Progress,MOOCs,,CS,,N,
MOOC Dropout Prediction: How to Measure Accuracy?  161-164,2017,WIP,Work in Progress,MOOCs,,Unspecified,,N,
MOOClets: A Framework for Dynamic Experimentation and Personalization,2017,WIP,Work in Progress,MOOCs,,Unspecified,,N,
Mobilizing the Crowd to Create an Open Repository of Research Talks,2017,WIP,Work in Progress,Other,,Unspecified,,N,
Modeling MOOC Student Behavior With Two-Layer Hidden Markov Models,2017,WIP,Work in Progress,MOOCs,,Non-STEM,,N,
Observing Personalizations in Learning: Identifying Heterogeneous Treatment Effects Using Causal Trees,2017,WIP,Work in Progress,Other,,CS,,N,
One Decision Tree is Enough to Make Customization,2017,WIP,Work in Progress,Other,,Unspecified,,N,
Orchestration Graphs: Enabling Rich Social Pedagogical Scenarios in MOOCs,2017,WIP,Work in Progress,MOOCs,,CS,,N,
"Pass the Idea Please: The Relationship between Network Position, Direct Engagement, and Course Performance in MOOCs",2017,WIP,Work in Progress,MOOCs,,Multiple,"Two of these sessions were different offerings of Innovation, a course on entrepreneurship which heavily encouraged forum participation. The other session was Matlab, a course on programming.",N,
Preventing Keystroke Based Identification in Open Data Sets,2017,Full Paper,Integrity of Courses and Learners,MOOCs,,Multiple,,N,
ProjectLens: Supporting Project-based Collaborative Learning on MOOCs,2017,WIP,Work in Progress,MOOCs,,Non-CS STEM,,N,
Robust Evaluation Matrix: Towards a More Principled Offline Exploration of Instructional Policies,2017,Full Paper,Engineering Learning Environments,Other,,Unspecified,,N,
Scaling Expert Feedback: Two Case Studies,2017,Full Paper,Feedback for Improving Learning,Online degrees,,CS,,N,
Suggesting a Log-Based Creativity Measurement for Online Programming Learning Environment,2017,WIP,Work in Progress,Other,,Unspecified,,N,
Taking Informed Action on Student Activity in MOOCs,2017,WIP,Work in Progress,MOOCs,,Unspecified,,N,
Teaching Students to Recognize and Implement Good Coding Style,2017,Full Paper,Learn to Code,Other,,CS,,N,
"Teamscope: Scalable Team Evaluation via Automated Metric Mining for Communication, Organization, Execution, and Evolution",2017,WIP,Work in Progress,Other,,Multiple,,N,
The Changing Patterns of MOOC Discourse,2017,WIP,Work in Progress,MOOCs,,Non-CS STEM,,N,
Towards Equal Opportunities in MOOCs: Affirmation Reduces Gender & Social-Class Achievement Gaps in China,2017,Full Paper,Experimentation,MOOCs,,Unspecified,,Y,"This study advances research on a social psychological bar rier to achievement that exists alongside important structural barriers (e.g., Internet access, insufficient prior knowledge). Learners who experience social identity threat (SIT)—a fear of being judged negatively in light of a social group they iden tify with—are at risk of underperforming."
Using Student Annotated Hashtags and Emojis to Collect Nuanced Affective States,2017,WIP,Work in Progress,MOOCs,,Multiple,,N,
What are the Expectations of Disabled Learners when Participating in a MOOC?  225-228,2017,WIP,Work in Progress,MOOCs,,Unspecified,,Y,"In order to direct efforts towards developing accessible MOOCs, it is important to understand the current expectations of disabled learners. Analysis of data from MOOC surveys that support disclosure of disability provide quantitative information such as the proportions participating in MOOCs; their reasons for participating, and the types of MOOCs they prefer."
Writing Reusable Code Feedback at Scale with Mixed-Initiative Program Synthesis,2017,Full Paper,Feedback for Improving Learning,Other,,CS,,N,
(A)I Will Teach You to Play Gomoku: Exploring the Use of Game AI to Teach People,2022,WIP,Work in Progress,Other,,Non-CS STEM,,N,
A Blended-Learning Program for Implementing a Rigorous Machine-Learning Curriculum in High-Schools,2022,WIP,Work in Progress,K-12,,Unspecified,,N,
A Chatbot-Server Framework for Scalable Machine Learning Education through Crowdsourced Data,2022,WIP,Work in Progress,K-12,,Multiple,,N,
A Study about Future Prospects of JupyterHub in MOOCs,2022,WIP,Work in Progress,MOOCs,,Unspecified,,N,
Adding a Demographic Lens to Cluster Analysis of Participants in Entry-level Massive Open Online Courses (MOOCs),2022,WIP,Work in Progress,MOOCs,,Multiple,,Y,"Results indicate that, in the courses analysed, learners without a college degree are more likely to be high-performing compared to college-educated learners; additionally, learners from approximated lower socioeconomic backgrounds are no less likely to be successful than learners from approximated middle and higher socioeconomic backgrounds in the USA. These findings are noteworthy insofar as they indicate that, while MOOCs have struggled to improve access to learning broadly speaking, there are possibilities for more inclusive outcomes."
Advancing the Democratization of Research: Citizen Science,2022,WIP,Work in Progress,Other,,Non-CS STEM,,Y,we have explored the potential of inclusive research in citizen science [11] working with people with learning disabilities and developing methods for increasing their engagement with citizen science.
Amazon Alexa Skills as a Novel Modality for In-service Professional Micro-Development (WIP),2022,WIP,Work in Progress,Other,,Non-CS STEM,,N,
An Examination of Unofficial Course Reviews in a Graduate Program at Scale,2022,WIP,Work in Progress,Online degrees,,CS,,N,
"Analysis of the Applicability of General Scaling Laws on Course Size, Completion Rates, and Forum Activity in MOOCs",2022,WIP,Work in Progress,MOOCs,,Non-STEM,,N,
BlockLens: Visual Analytics of Student Coding Behaviors in Block-Based Programming Environments,2022,WIP,Work in Progress,K-12,,Unspecified,,N,
Challenges of Scaling Programming-based Behavioral Metrics,2022,WIP,Work in Progress,Informal learning environment,,Unspecified,,N,
Collaboration at Scale: Exploring Member Role Changing Patterns in Collaborative Science Problem-solving Tasks,2022,WIP,Work in Progress,K-12,,Unspecified,,N,
Collaborative Annotation: Links to Formative Assessment and Issues of Scale for Pedagogy,2022,WIP,Work in Progress,Other,,Non-CS STEM,,N,
Comparing MOOC Learners Engagement with Japanese Videos and Text to Speech Generated English Videos,2022,WIP,Work in Progress,MOOCs,,Non-CS STEM,,Y,providing transcripts is ineffective for visually impaired learners and tends to divert learners’ attention away from the overall content of the video lecture.
Developing Student's Global Competencies at Scale in an Affordable MOOC K12 Outreach Initiative,2022,WIP,Work in Progress,MOOCs,,Non-CS STEM,,Y,"Global education for cultivating global citizens is an essential educational topic for communities today. However, the standardized public curriculum has limited opportunities to cultivate K12 students to become global citizens."
Discrimination of Automatically Generated Questions Used as Formative Practice,2022,WIP,Work in Progress,Other,,Unspecified,,N,
EdTech and Girls Education in Low- and Middle-Income Countries: Which Intervention Types Have the Greatest Impact on Learning Outcomes for Girls?  330-334,2022,WIP,Work in Progress,K-12,,CS,,Y,"The findings suggest that interventions which focus on distribut ing hardware alone have mixed- and sometimes negative- effects on learning outcomes for girls. The impact of software-focused interventions is more positive, particularly personalised learning applications."
Effects of Framing Professional Development as a Career Growth Opportunity on Course Completion,2022,WIP,Work in Progress,Other,,Multiple,,Y,Professional development (PD) trainings
Exploring the Relationships between Social and Teaching Presence in Video-based Informal Learning Using Network Analysis,2022,WIP,Work in Progress,Other,,Unspecified,,N,
How COVID-19 Affected Computer Science MOOC Learner Behavior and Achievements: A Demographic Study,2022,WIP,Work in Progress,MOOCs,,Non-STEM,,Y,"In this study we found that the underrepresented learners in a set of introductory Python MOOCs exhibited a greater negative effect associated with the pandemic, and the effect increased for the more difficult course in the sequence."
How Much and for Whom?: A Multi-Wave Study of the Impact of Self-Regulated Learning Scaffolds on MOOC Student Academic Performance,2022,WIP,Work in Progress,MOOCs,,Multiple,,N,
Incorporating Explainable Learning Analytics to Assist Educators with Identifying Students in Need of Attention,2022,WIP,Work in Progress,Other,,Unspecified,,Y,This paper reports on the development of a learning analytics (LA) technique called Student Inspection Facilitator (SIF) that provides an explainable interpretation of stu dents learning behaviour to support instructors with the identi f ication of students in need of attention.
Influential Text-Based Features in Predicting Admission Status of Online Degree Applicants,2022,WIP,Work in Progress,Online degrees,,Non-CS STEM,,N,
Integrating Dynamic Supports into an Equity Teaching Simulation to Promote Equity Mindsets,2022,WIP,Work in Progress,Other,,Non-CS STEM,,Y,"Implementing high-quality professional learning on diversity, eq uity, and inclusion (DEI) issues is a massive scaling challenge. Inte grating dynamic support using natural language processing (NLP) into equity teaching simulations may allow for more responsive, personalized training in this field."
LEDA: A Learning Analytics Based Framework to Analyze Remote Labs Interaction,2022,WIP,Work in Progress,Other,,Unspecified,,N,
Large-scale Analysis of Discussion Networks in College Courses,2022,WIP,Work in Progress,Other,,CS,,N,
Laugh at Your Own Pace: Basic Performance Evaluation of Language Learning Assistance by Adjustment of Video Playback Speeds Based on Laughter Detection,2022,WIP,Work in Progress,Other,,Unspecified,,Y,"it is difficult for many L2 learn ers to smoothly and effortlessly comprehend video contents made for native speakers at the original speed. Therefore, we developed a language learning assistance system that automatically adjusts the playback speed according to the learner’s comprehension."
Learning Alone Yet Together: Enhancing Between-Learner Social Connectivity at Scale,2022,WIP,Work in Progress,MOOCs,,CS,,Y,"MOOCs rely on asynchronous sessions to meet the individual need of a massive number of students geographically distributed. While the asynchronous design ensures the flexibility and accessibility of delivering courses at scale, the absence of synchronous opportunities brings up problems such as reduced interactivity and even the sense of isolation. However, as synchronicity in essence contradicts the asynchronous design which is considered to foster the fundamental appeal of MOOCs, adding synchronous parts to MOOCs in a simple and straightforward way is not feasible. To address this, an emerging functionality which is popular in entertainment video watching but newly used in MOOC learning is explored and evaluated. In this functionality, the lecture video and communication between learners are still implemented in an asynchronous way whereas the chat messages sent by previous and present learners in the process of watching are organized and displayed according to their sending timestamps along the video playback timeline to create an atmosphere of 'pseudo-synchronicity'."
Math Discourse Linguistic Components (Cohesive Cues within a Math Discussion Board Discourse),2022,WIP,Work in Progress,Other,,CS,,N,
Measuring Cultural Dimensions of Learning in Online Courses,2022,WIP,Work in Progress,Other,,Non-CS STEM,,Y,"Online courses lower geographic barriers to educational access and attract learners from around the world. The resulting cultural di versity in online courses has implications for learning preferences, behaviors and outcomes, but established measures of culture are not adapted to educational contexts. We adapted and tested a sur vey instrument of cultural dimensions of learning that is grounded in cultural psychology research and spans four dimensions: knowl edge construction, pedagogical orientation, uncertainty tolerance, and consensus building."
Providing Individual Student Feedback at Scale for Mathematical Disciplines,2022,WIP,Work in Progress,Other,,CS,,N,
Re-envisioning a K-12 Early Warning System with School Climate Factors,2022,WIP,Work in Progress,K-12,,Non-CS STEM,,Y,"These preliminary analyses suggest that a culturally inclusive, socially supportive, and emotionally and phys ically safe school climate is related to academic success and fewer engagement/behavior problems at the school level."
Revealing Factors Influencing Students' Perceived Fairness: A Case with a Predictive System for Math Learning,2022,WIP,Work in Progress,Other,,CS,,N,
Scaling Up Access to the Hidden Curriculum: A Design Methodology for Creating Undergraduate Mentoring Guides,2022,WIP,Work in Progress,Other,,CS,,N,
Seeking Exemplars in the Wild: Exploring How Students Find Design Examples to Support Personalized Learning,2022,WIP,Work in Progress,Other,,Unspecified,,N,
Student Use of Course Reviews at Scale,2022,WIP,Work in Progress,Other,,Multiple,,N,
Teaching and Learning Programming with Linux using In-Browser Client-Side Web Technologies: Exploring the Key Features for Achieving Systems and Tools Scalability,2022,WIP,Work in Progress,Other,,CS,,N,
The Relationship Between COVID-19 Severity and Computer Science MOOC Learner Achievement: A Preliminary Analysis,2022,WIP,Work in Progress,MOOCs,,Non-CS STEM,,N,
Towards a Teacher Application to Support Semantic Annotations of Learning Tasks in Cultural Heritage,2022,WIP,Work in Progress,Other,,Multiple,,N,
Understanding the Relationship Between Students' Learning Outcome and Behavioral Patterns using Touch Trajectories,2022,WIP,Work in Progress,Other,,Unspecified,,N,
Using Chatbots to Teach Languages,2022,WIP,Work in Progress,Other,,Unspecified,,N,
Using a Planning Prompt Survey to Encourage Early Completion of Homework Assignments,2022,WIP,Work in Progress,Other,,CS,,N,
Where are the Large N Studies in Education?: Introducing a Dataset of Scientific Articles and NLP Techniques,2022,WIP,Work in Progress,Others,,Unspecified,,N,
Replicating MOOC Predictive Models at Scale,2018,Full Paper,NA,MOOCs,,Non-CS STEM,,N,
"Students, Systems, and Interactions: Synthesizing the First Four Years of Learning@Scale and Charting the Future",2018,Full Paper,NA,Other,,CS,,Y,student-centric study papers focused on modeling knowledge and on promoting global access and equity.
The Potential for Scientific Outreach and Learning in Mechanical Turk Experiments,2018,Full Paper,NA,Other,,CS,,N,
Toward Large-Scale Learning Design Categorizing Course Designs in Service of Supporting Learning Outcomes,2018,Full Paper,NA,MOOCs,,CS,,N,
Addressing Two Problems in Deep Knowledge Tracing via Prediction-Consistent Regularization,2018,Full Paper,NA,Other,,Unspecified,,N,
The Effects of Adaptive Learning in a Massive Open Online Course on Learners’ Skill Development,2018,Full Paper,NA,MOOCs,,Mutiple,,N,
QG-Net: A Data-Driven Question Generation Model for Educational Content,2018,Full Paper,NA,Other,,CS,,N,
Towards Domain General Detection of Transactive Knowledge Building Behavior,2018,Full Paper,NA,Other,,CS,,N,
Docent: Transforming personal intuitions to scientific hypotheses through content learning and process training,2018,Full Paper,NA,Other,,CS,,N,
Supporting Answerers with Feedback in Social Q&A,2018,Full Paper,NA,Other,,CS,,N,
Refocusing the Lens on Engagement in MOOCs,2018,Full Paper,NA,MOOCs,,CS,,N,
"The Relationship between Scientific Explanations and the Proficiencies of Content, Inquiry, and Writing",2018,Full Paper,NA,Other,,Unspecified,,N,
Classifying and Visualizing Students’ Cognitive Engagement in Course Readings,2018,Full Paper,NA,Other,,Non-CS STEM,,N,
Squeezing the Limeade: Policies and Workflows for Scalable Online Degrees,2018,Full Paper,NA,Online degrees,,Non-CS STEM,,N,
How Do Professors Format Exams? An Analysis of Question Variety at Scale,2018,Full Paper,NA,Other,,Unspecified,,N,
OARS: Exploring Instructor Analytics for Online Learning,2018,Full Paper,NA,Other,,Non-CS STEM,,N,
The Potential of Interdisciplinarity in MOOC Research: How Do Education and Computer Science Intersect?,2018,Full Paper,NA,MOOCs,,Unspecified,,N,
Codemotion: Expanding the Design Space of Learner Interactions with Computer Programming Tutorial Videos,2018,Full Paper,NA,Other,,Unspecified,,N,
Elicast: Embedding Interactive Exercises in Instructional Programming Screencasts,2018,Full Paper,NA,MOOCs,,Non-CS STEM,,N,
Toward CS1 at Scale: Building and Testing a MOOC-for-Credit Candidate,2018,Full Paper,NA,MOOCs,,Unspecified,,Y,"We found the online students more likely to be older; to be underrepresented minorities; and to have previously failed a CS class. We then found that our online students attained comparable learning outcomes to students in the traditional section. Finally, we found that our online students perceived the online course quality more positively and required less time to achieve those comparable learning outcomes."
Effects of Automated Interventions in Programming Assignments: Evidence from a Field Experiment,2018,Full Paper,NA,MOOCs,,Unspecified,,N,
The unbearable lightness of consent: Mapping MOOC providers’ response to consent,2018,Full Paper,NA,MOOCs,,Unspecified,,N,
How Much Randomization is Needed to Deter Collaborative Cheating on Asynchronous Exams?,2018,Full Paper,NA,Other,,Unspecified,,N,
How a data-driven course planning tool affects college students’ GPA: Evidence from two field experiments,2018,Full Paper,NA,Other,,Unspecified,,N,
Toward a Large-Scale Open Learning System for Data Management,2018,Short Paper - WIP mentioned,,Other,,Unspecified,,N,
A Content Engagement Score for Online Learning Platforms,2018,Short Paper - WIP mentioned,,Other,,Multiple,,N,
Use expert knowledge instead of data – generating hints for Hour of Code exercises –,2018,Short Paper - WIP mentioned,,MOOCs,,Unspecified,,N,
The Impact of the Peer Review Process Evolution on Learner Performance in e-Learning Environments,2018,Short Paper - WIP mentioned,,Other,,Non-STEM,,N,
Virtualizing face-2-face trainings for training senior professionals: A Comparative Case Study on Financial Auditors,2018,Short Paper - Progress mentioned,,Other,,Non-CS STEM,,N,
Student Trust in e-Authentication,2018,Short Paper - WIP mentioned,,Other,,CS,,N,
Information Overload and Online Collaborative Learning: Insights from Agent-Based Modeling,2018,Short Paper - WIP mentioned,,Online degrees,,Multiple,,N,
Designing a Learning Analytics Dashboard for Twitter facilitated Teaching,2018,Short Paper - WIP mentioned,,Other,,Unspecified,,N,
Grading at Scale in EarSketch,2018,Short Paper - WIP mentioned,,Other,,Non-CS STEM,,N,
Transformative approaches in distance online education: aligning evidence to influence the design of teaching at scale,2018,Short Paper - WIP mentioned,,Online degrees,,Unspecified,,N,
Start of a Science: An Epistemological Analysis of Learning at Scale,2019,Full Paper,Broader Issues,Other,,CS,,N,
Can a diversity statement increase diversity in MOOCs?,2019,Full Paper,Broader Issues,MOOCs,,CS,,Y,"A longitudinal matched-pairs experiment with 14 MOOCs (N=29,000) tested this theory by manipulating the presence of a diversity statement on course pages and measuring effects on who enrolls. We found a 3% increase in the proportion of students with lower socioeconomic status. The effect size varied across courses between-0.5 and 7 percentage points. No significant changes in enrollment patterns by gender, age, and national development level occurred."
Multiplatform MOOC Analytics: Comparing Global and Regional Patterns in edX and Edraak,2019,Full Paper,Broader Issues,MOOCs,,Unspecified,,Y,"Comparing learners from Arab countries on edX to those on Edraak, the Edraak population has a more even genderon Edraak, the Edraak population has a more even gender balance, more learners with lower education levels, greater participation from more developing countries, higher levels of persistence and completion, and a larger total population of learners."
On the Acceptance and Usefulness of Personalized Learning Objectives in MOOCs,2019,Full Paper,Broader Issues,MOOCs,,CS,,N,
Graded Team Assignments in MOOCs - Effects of Team Composition and Further Factors on Team Dropout Rates and Performance,2019,Full Paper,Engagement,MOOCs,,Non-STEM,,N,
How Learners Engage with In-Context Retrieval Exercises in Online Informational Videos,2019,Full Paper,Engagement,Other,,Unspecified,,N,
"Instructors Desire Student Activity, Literacy, and Video Quality Analytics to Improve Video-based Blended Courses",2019,Full Paper,Engagement,Other,,Unspecified,,N,
Growth Mindset Predicts Student Achievement and Behavior in Mobile Learning,2019,Full Paper,Engagement,Other,,Multiple,,Y,"This research investigates non-cognitive factors in mobile learning in a resource poor context. We surveyed 1,000 Kenyan high school stu dents who use a popular SMS-based learning platform that provides formative assessments aligned with the national curriculum."
Improv: Teaching Programming at Scale via Live Coding,2019,Full Paper,Domain Specific,MOOCs,,CS,,N,
Scaffolding during Science Inquiry,2019,Full Paper,Domain Specific,K-12,,Unspecified,,N,
Teaching UI Design at Global Scales: A Case Study of the Design of Collaborative Capstone Projects for MOOCs,2019,Full Paper,Domain Specific,MOOCs,,Unspecified,,N,
Inequality: multi-modal equation entry on the web,2019,Full Paper,Domain Specific,Other,,Non-CS STEM,,N,
Automatic Assessment of Complex Assignments using Topic Models,2019,Full Paper,Assessment,Other,,Unspecified,,N,
Designing Digital Peer Assessment for Second Language Learning in Low Resource Learning Settings,2019,Full Paper,Assessment,MOOCs,,Unspecified,,Y,"In this paper, we present the design of a peer assessment system for second language learning (English as a Second Language) for high school learners in South Africa. We report findings from multiple studies investigating qualitative and quantitative aspects of peer review, as well as the contextual factors that influence the viability of peer assessment systems in these contexts. "
Mining Students Pre-instruction Beliefs for Improved Learning,2019,Full Paper,Assessment,Other,,CS,,N,
Scaling Up Writing in the Curriculum: Batch Mode Active Learning for Automated Essay Scoring,2019,Full Paper,Assessment,Other,,Unspecified,,N,
UpGrade: Sourcing Student Open-Ended Solutions to Create Scalable Learning Opportunities,2019,Full Paper,Learning Support,Other,,Non-CS STEM,,N,
